{
  "id": "pre-beryl-mint-pause-before-policy",
  "category": "revert_bytes",
  "polarity": "negative",
  "split": "dev",
  "source": "historical",
  "base_commit": "10f50b19737f82289e833846f91df692b2e0853f",
  "reference_commit": "75d746d794f3e8440856de11a3355b21045225e9",
  "ticket": "A paused B-20 token whose mint receiver is blocked by policy reverts with PolicyForbids on mint. It should revert with ContractPaused, matching transfer. Make the pause check run before the mint-receiver policy check, and add a regression test.",
  "fork_state": {
    "as_of": "2026-05-29",
    "mainnet": {
      "live": [],
      "scheduled": []
    },
    "sepolia": {
      "live": [],
      "scheduled": []
    },
    "zeronet": {
      "live": [],
      "scheduled": []
    }
  },
  "expected": {
    "verdict": "proceed",
    "approach": "edit_in_place",
    "activation_fork": "Beryl",
    "versions": {
      "create": [],
      "modify": [],
      "frozen": []
    },
    "files": {
      "create": [],
      "modify": [
        "crates/common/precompiles/src/common/ops/mintable.rs"
      ],
      "must_not_modify": []
    },
    "symmetric_modules": [],
    "surfaces": {
      "gas": false,
      "revert_bytes": true,
      "storage": false,
      "abi": false,
      "events": false
    },
    "tests": {
      "existing_goldens_unchanged": true,
      "new": [
        "paused mint with a policy-denied receiver reverts ContractPaused"
      ]
    }
  },
  "grading": {
    "critical_files": [
      "crates/common/precompiles/src/common/ops/mintable.rs"
    ],
    "allowed_extra_files": [
      "crates/common/precompile*/Cargo.toml",
      "crates/common/precompile*/src/**/mod.rs",
      "crates/common/precompile*/src/lib.rs",
      "crates/common/precompiles/src/common/ops/*.rs",
      "crates/common/precompiles/src/common/test_utils.rs",
      "crates/common/precompiles/tests/**"
    ],
    "alternatives": [],
    "graded_surfaces": [
      "gas",
      "revert_bytes",
      "storage",
      "abi",
      "events"
    ]
  },
  "rubric": [
    {
      "id": "nothing_live",
      "check": "The plan recognizes that no network has scheduled the upgrade that ships this code, so there is no executed behavior to preserve.",
      "critical": false
    },
    {
      "id": "no_version_gate",
      "check": "The plan edits the shared mint logic directly and does not introduce a logic version or fork gate.",
      "critical": true
    }
  ],
  "notes": "No network has Beryl scheduled. Reordering guards changes revert bytes, but nothing has executed, so editing in place is correct. A version or fork gate is over-engineering."
}
