{
  "id": "pre-beryl-transfer-zero-receiver-first",
  "category": "revert_bytes",
  "polarity": "negative",
  "split": "holdout",
  "source": "historical",
  "base_commit": "75d746d794f3e8440856de11a3355b21045225e9",
  "reference_commit": "0327b15d897b1e0195a3f1ed9f753309e6165f08",
  "ticket": "When both from and to are the zero address, B-20 transfer reverts with InvalidSender. The base-std Solidity reference reverts with InvalidReceiver in that case. Align the precompile with the reference and add a regression test.",
  "fork_state": {
    "as_of": "2026-05-29",
    "mainnet": {
      "live": [],
      "scheduled": []
    },
    "sepolia": {
      "live": [],
      "scheduled": []
    },
    "zeronet": {
      "live": [],
      "scheduled": []
    }
  },
  "expected": {
    "verdict": "proceed",
    "approach": "edit_in_place",
    "activation_fork": "Beryl",
    "versions": {
      "create": [],
      "modify": [],
      "frozen": []
    },
    "files": {
      "create": [],
      "modify": [
        "crates/common/precompiles/src/common/ops/transferable.rs"
      ],
      "must_not_modify": []
    },
    "symmetric_modules": [],
    "surfaces": {
      "gas": false,
      "revert_bytes": true,
      "storage": false,
      "abi": false,
      "events": false
    },
    "tests": {
      "existing_goldens_unchanged": true,
      "new": [
        "transfer with from == to == address(0) reverts InvalidReceiver"
      ]
    }
  },
  "grading": {
    "critical_files": [
      "crates/common/precompiles/src/common/ops/transferable.rs"
    ],
    "allowed_extra_files": [
      "crates/common/precompile*/Cargo.toml",
      "crates/common/precompile*/src/**/mod.rs",
      "crates/common/precompile*/src/lib.rs",
      "crates/common/precompiles/src/common/ops/*.rs",
      "crates/common/precompiles/src/common/test_utils.rs",
      "crates/common/precompiles/tests/**"
    ],
    "alternatives": [],
    "graded_surfaces": [
      "gas",
      "revert_bytes",
      "storage",
      "abi",
      "events"
    ]
  },
  "rubric": [
    {
      "id": "nothing_live",
      "check": "The plan recognizes that no network runs this code yet, so the revert order can change without a fork gate.",
      "critical": true
    }
  ],
  "notes": "Pre-Beryl. Swapping guard order changes revert bytes for one input, but nothing has executed it."
}
