{
  "id": "denim-inverted-policy-ids",
  "category": "scaffold_logic_abi",
  "polarity": "positive",
  "split": "dev",
  "source": "historical",
  "base_commit": "9b50489852c1f8c2077094ccf7b4e6aadfc907bc",
  "reference_commit": "eda899b42102e981b7726f2d0e7df4a61ce6beeb",
  "ticket": "Add inverted policy IDs at Denim: a high bit on a policy ID inverts its authorization result, plus an invertedPolicyId(uint64) view selector. Beryl and Cobalt must keep rejecting the new selector exactly as they do today.",
  "fork_state": {
    "as_of": "2026-09-17",
    "mainnet": {
      "live": [
        "Beryl"
      ],
      "scheduled": []
    },
    "sepolia": {
      "live": [
        "Beryl"
      ],
      "scheduled": [
        "Cobalt"
      ]
    },
    "zeronet": {
      "live": [
        "Beryl"
      ],
      "scheduled": []
    }
  },
  "expected": {
    "verdict": "proceed",
    "approach": "edit_in_place",
    "activation_fork": "Denim",
    "versions": {
      "create": [],
      "modify": [
        "V3"
      ],
      "frozen": [
        "V1",
        "V2"
      ]
    },
    "files": {
      "create": [
        "crates/common/precompiles/src/policy/abi/v3.rs"
      ],
      "modify": [
        "crates/common/precompiles/src/lib.rs",
        "crates/common/precompiles/src/policy/abi/mod.rs",
        "crates/common/precompiles/src/policy/dispatch.rs",
        "crates/common/precompiles/src/policy/logic/interface.rs",
        "crates/common/precompiles/src/policy/logic/v3.rs",
        "crates/common/precompiles/src/policy/mod.rs",
        "crates/common/precompiles/src/policy/versions.rs",
        "crates/common/precompiles/tests/b20_policy_v1_golden.rs",
        "crates/common/precompiles/tests/b20_policy_v2_golden.rs",
        "crates/common/precompiles/tests/b20_policy_v3_golden.rs"
      ],
      "must_not_modify": [
        "crates/common/precompiles/src/policy/logic/v1.rs",
        "crates/common/precompiles/src/policy/logic/v2.rs"
      ]
    },
    "symmetric_modules": [
      "policy"
    ],
    "surfaces": {
      "gas": false,
      "revert_bytes": true,
      "storage": false,
      "abi": true,
      "events": false
    },
    "tests": {
      "existing_goldens_unchanged": true,
      "new": [
        "V1 and V2 reject the new selector",
        "V3 toggles the bit"
      ]
    }
  },
  "grading": {
    "critical_files": [
      "crates/common/precompiles/src/policy/logic/v3.rs",
      "crates/common/precompiles/src/policy/versions.rs"
    ],
    "allowed_extra_files": [
      "crates/common/precompile*/Cargo.toml",
      "crates/common/precompile*/src/**/mod.rs",
      "crates/common/precompile*/src/lib.rs",
      "crates/common/precompiles/src/common/ops/*.rs",
      "crates/common/precompiles/src/common/test_utils.rs",
      "crates/common/precompiles/src/policy/**",
      "crates/common/precompiles/tests/**"
    ],
    "alternatives": [],
    "graded_surfaces": [
      "gas",
      "revert_bytes",
      "storage",
      "abi",
      "events"
    ]
  },
  "rubric": [
    {
      "id": "new_abi_surface",
      "check": "The plan adds a new frozen ABI surface for Denim rather than editing the Cobalt ABI.",
      "critical": true
    },
    {
      "id": "fail_closed",
      "check": "The plan makes an inverted ID for a nonexistent policy fail closed.",
      "critical": false
    }
  ],
  "notes": "Logic plus ABI in unshipped V3."
}
