{
  "id": "beryl-restore-stablecoin-update-policy-order",
  "category": "old_fork_change",
  "polarity": "positive",
  "split": "holdout",
  "source": "historical",
  "base_commit": "b2bf3cfa40744d2c77607a9570df29393d2f782e",
  "reference_commit": "77d4ff62701d54577a224ecfffbec309e8a71c2f",
  "ticket": "Stablecoin V1 updatePolicy checks policyExists(newPolicyId) before reading the old policyId. The Beryl reference that networks executed reads the old policyId first, so the invalid-new-ID path now spends one fewer SLOAD than canonical. Fix the divergence and pin it with a test.",
  "fork_state": {
    "as_of": "2026-08-21",
    "mainnet": {
      "live": [
        "Beryl"
      ],
      "scheduled": []
    },
    "sepolia": {
      "live": [
        "Beryl"
      ],
      "scheduled": []
    },
    "zeronet": {
      "live": [
        "Beryl"
      ],
      "scheduled": []
    }
  },
  "expected": {
    "verdict": "proceed",
    "approach": "edit_in_place",
    "activation_fork": "Beryl",
    "versions": {
      "create": [],
      "modify": [
        "V1"
      ],
      "frozen": []
    },
    "files": {
      "create": [],
      "modify": [
        "crates/common/precompiles/src/b20_stablecoin/logic/v1.rs",
        "crates/common/precompiles/tests/b20_stablecoin_v1_golden.rs"
      ],
      "must_not_modify": [
        "crates/common/precompiles/src/b20_stablecoin/logic/v2.rs"
      ]
    },
    "symmetric_modules": [
      "b20_stablecoin"
    ],
    "surfaces": {
      "gas": true,
      "revert_bytes": false,
      "storage": false,
      "abi": false,
      "events": false
    },
    "tests": {
      "existing_goldens_unchanged": true,
      "new": [
        "V1 golden gas footprint pins the old-policy SLOAD on the revert path"
      ]
    }
  },
  "grading": {
    "critical_files": [
      "crates/common/precompiles/src/b20_stablecoin/logic/v1.rs"
    ],
    "allowed_extra_files": [
      "crates/common/precompile*/Cargo.toml",
      "crates/common/precompile*/src/**/mod.rs",
      "crates/common/precompile*/src/lib.rs",
      "crates/common/precompiles/src/common/ops/*.rs",
      "crates/common/precompiles/src/common/test_utils.rs",
      "crates/common/precompiles/tests/**"
    ],
    "alternatives": [],
    "graded_surfaces": [
      "gas",
      "revert_bytes",
      "storage",
      "abi",
      "events"
    ]
  },
  "rubric": [
    {
      "id": "canonical_reference",
      "check": "The plan restores V1 to the behavior Beryl networks executed.",
      "critical": true
    },
    {
      "id": "gas_on_revert",
      "check": "The plan explains that gas spent before a revert is consensus-visible.",
      "critical": false
    }
  ],
  "notes": "This commit reverted an earlier merged reorder (c257e9fccf) that wrongly claimed Beryl was zeronet-only. That earlier commit is deliberately excluded as a reference."
}
