{
  "id": "cobalt-zero-address-before-policy-sload",
  "category": "gas_semantics",
  "polarity": "positive",
  "split": "holdout",
  "source": "historical",
  "base_commit": "3eb481791135e465e7e1682218f1e4619b574fa6",
  "reference_commit": "90a7a2a2daf867b5a12626779d8b7144a42c68d7",
  "ticket": "Unprivileged V2 transfer loads policy IDs before checking for a zero from or to address. On a zero-address revert that SLOAD gas is not refunded, diverging from transferFrom and the Cobalt reference. Fix it for asset and stablecoin.",
  "fork_state": {
    "as_of": "2026-09-01",
    "mainnet": {
      "live": [
        "Beryl"
      ],
      "scheduled": []
    },
    "sepolia": {
      "live": [
        "Beryl"
      ],
      "scheduled": []
    },
    "zeronet": {
      "live": [
        "Beryl"
      ],
      "scheduled": []
    }
  },
  "expected": {
    "verdict": "proceed",
    "approach": "edit_in_place",
    "activation_fork": "Cobalt",
    "versions": {
      "create": [],
      "modify": [
        "V2"
      ],
      "frozen": [
        "V1"
      ]
    },
    "files": {
      "create": [
        "crates/common/precompiles/src/common/ops/non_zero_address.rs"
      ],
      "modify": [
        "crates/common/precompiles/src/b20_asset/logic/v2.rs",
        "crates/common/precompiles/src/b20_stablecoin/logic/v2.rs",
        "crates/common/precompiles/src/common/mod.rs",
        "crates/common/precompiles/src/common/ops/mod.rs",
        "crates/common/precompiles/src/lib.rs",
        "crates/common/precompiles/tests/b20_asset_v2_golden.rs",
        "crates/common/precompiles/tests/b20_stablecoin_v2_golden.rs"
      ],
      "must_not_modify": [
        "crates/common/precompiles/src/b20_asset/logic/v1.rs",
        "crates/common/precompiles/src/b20_stablecoin/logic/v1.rs",
        "crates/common/precompiles/tests/b20_asset_v1_golden.rs",
        "crates/common/precompiles/tests/b20_stablecoin_v1_golden.rs"
      ]
    },
    "symmetric_modules": [
      "b20_asset",
      "b20_stablecoin"
    ],
    "surfaces": {
      "gas": true,
      "revert_bytes": false,
      "storage": false,
      "abi": false,
      "events": false
    },
    "tests": {
      "existing_goldens_unchanged": true,
      "new": [
        "V2 golden: zero-address reverts perform no policy SLOAD"
      ]
    }
  },
  "grading": {
    "critical_files": [
      "crates/common/precompiles/src/b20_asset/logic/v2.rs",
      "crates/common/precompiles/src/b20_stablecoin/logic/v2.rs"
    ],
    "allowed_extra_files": [
      "crates/common/precompile*/Cargo.toml",
      "crates/common/precompile*/src/**/mod.rs",
      "crates/common/precompile*/src/lib.rs",
      "crates/common/precompiles/src/common/ops/*.rs",
      "crates/common/precompiles/src/common/test_utils.rs",
      "crates/common/precompiles/tests/**"
    ],
    "alternatives": [],
    "graded_surfaces": [
      "gas",
      "revert_bytes",
      "storage",
      "abi",
      "events"
    ]
  },
  "rubric": [
    {
      "id": "unshipped",
      "check": "The plan notes Cobalt is not scheduled, so V2 can change in place.",
      "critical": true
    },
    {
      "id": "v1_not_affected",
      "check": "The plan leaves V1 untouched.",
      "critical": false
    }
  ],
  "notes": "Gas-on-revert change in unshipped V2."
}
