{
  "id": "cobalt-implement-erc8056-in-v2",
  "category": "scaffold_logic_abi",
  "polarity": "negative",
  "split": "holdout",
  "source": "historical",
  "base_commit": "dcf277ae6ebafee56d64a59b3a308b40440b1f6d",
  "reference_commit": "b2d5a86feede34d9ad22d9cb6e35397be05f28fd",
  "ticket": "Implement the ERC-8056 scheduled multiplier behavior in the asset token: setUIMultiplier, cancelScheduledMultiplier and the UI-scaled views. The selectors, errors, events and storage already exist on the Cobalt surface.",
  "fork_state": {
    "as_of": "2026-07-27",
    "mainnet": {
      "live": [
        "Beryl"
      ],
      "scheduled": []
    },
    "sepolia": {
      "live": [
        "Beryl"
      ],
      "scheduled": []
    },
    "zeronet": {
      "live": [
        "Beryl"
      ],
      "scheduled": []
    }
  },
  "expected": {
    "verdict": "proceed",
    "approach": "edit_in_place",
    "activation_fork": "Cobalt",
    "versions": {
      "create": [],
      "modify": [
        "V2"
      ],
      "frozen": [
        "V1"
      ]
    },
    "files": {
      "create": [],
      "modify": [
        "crates/common/precompile-macros/src/accounting.rs",
        "crates/common/precompiles/src/b20_asset/accounting.rs",
        "crates/common/precompiles/src/b20_asset/dispatch.rs",
        "crates/common/precompiles/src/b20_asset/logic/v2.rs",
        "crates/common/precompiles/src/common/test_utils.rs"
      ],
      "must_not_modify": [
        "crates/common/precompiles/src/b20_asset/logic/v1.rs"
      ]
    },
    "symmetric_modules": [
      "b20_asset"
    ],
    "surfaces": {
      "gas": false,
      "revert_bytes": true,
      "storage": true,
      "abi": false,
      "events": true
    },
    "tests": {
      "existing_goldens_unchanged": true,
      "new": [
        "V2 unit tests for scheduling and cancelling"
      ]
    }
  },
  "grading": {
    "critical_files": [
      "crates/common/precompiles/src/b20_asset/logic/v2.rs"
    ],
    "allowed_extra_files": [
      "crates/common/precompile*/Cargo.toml",
      "crates/common/precompile*/src/**/mod.rs",
      "crates/common/precompile*/src/lib.rs",
      "crates/common/precompile-macros/src/**",
      "crates/common/precompiles/src/b20_asset/**",
      "crates/common/precompiles/src/common/ops/*.rs",
      "crates/common/precompiles/src/common/test_utils.rs",
      "crates/common/precompiles/tests/**"
    ],
    "alternatives": [],
    "graded_surfaces": [
      "gas",
      "revert_bytes",
      "storage",
      "abi",
      "events"
    ]
  },
  "rubric": [
    {
      "id": "edit_v2_in_place",
      "check": "The plan edits the existing V2 because Cobalt is not scheduled on any network, and does not create V3.",
      "critical": true
    },
    {
      "id": "v1_signatures_frozen",
      "check": "The plan avoids changing V1 code or trait signatures that V1 depends on.",
      "critical": false
    }
  ],
  "notes": "V2 already exists and Cobalt is unscheduled, so a new version is wrong. Under the surfaces convention, Cobalt previously ran the V2 scaffold where these selectors reverted; now they succeed, so revert bytes change, and the setters write storage and emit events."
}
