{
  "id": "zeronet-asset-zero-multiplier",
  "category": "revert_bytes",
  "polarity": "positive",
  "split": "dev",
  "source": "historical",
  "base_commit": "c2cf0f38a80ee1671645dc0b049b955887930e97",
  "reference_commit": "6372330f9cc62a324db7997f1c82952728ccc553",
  "ticket": "updateMultiplier on the asset token accepts zero, which would zero every scaled balance. Reject a zero multiplier with a new typed error added to the asset ABI. Zeronet is a pre-production network that is reset as needed; the team does not preserve zeronet execution.",
  "fork_state": {
    "as_of": "2026-06-10",
    "mainnet": {
      "live": [],
      "scheduled": []
    },
    "sepolia": {
      "live": [],
      "scheduled": []
    },
    "zeronet": {
      "live": [
        "Beryl"
      ],
      "scheduled": []
    }
  },
  "expected": {
    "verdict": "proceed",
    "approach": "edit_in_place",
    "activation_fork": "Beryl",
    "versions": {
      "create": [],
      "modify": [],
      "frozen": []
    },
    "files": {
      "create": [],
      "modify": [
        "crates/common/precompiles/src/b20_asset/abi.rs",
        "crates/common/precompiles/src/b20_asset/token.rs"
      ],
      "must_not_modify": []
    },
    "symmetric_modules": [
      "b20_asset"
    ],
    "surfaces": {
      "gas": false,
      "revert_bytes": true,
      "storage": false,
      "abi": true,
      "events": false
    },
    "tests": {
      "existing_goldens_unchanged": true,
      "new": [
        "updateMultiplier(0) reverts with the new error"
      ]
    }
  },
  "grading": {
    "critical_files": [
      "crates/common/precompiles/src/b20_asset/abi.rs",
      "crates/common/precompiles/src/b20_asset/token.rs"
    ],
    "allowed_extra_files": [
      "crates/common/precompile*/Cargo.toml",
      "crates/common/precompile*/src/**/mod.rs",
      "crates/common/precompile*/src/lib.rs",
      "crates/common/precompiles/src/common/ops/*.rs",
      "crates/common/precompiles/src/common/test_utils.rs",
      "crates/common/precompiles/tests/**"
    ],
    "alternatives": [
      {
        "reason": "A fork gate is safe, just unnecessary.",
        "approach": "fork_gate"
      }
    ],
    "graded_surfaces": [
      "gas",
      "revert_bytes",
      "storage",
      "abi",
      "events"
    ]
  },
  "rubric": [
    {
      "id": "zeronet_reasoning",
      "check": "The plan concludes an in-place change is acceptable because only zeronet runs Beryl and zeronet execution is not preserved.",
      "critical": true
    },
    {
      "id": "typed_error",
      "check": "The plan adds a new typed error to the asset ABI for the zero multiplier.",
      "critical": false
    }
  ],
  "notes": "Only zeronet has Beryl live, and the ticket says zeronet is not preserved."
}
